title,article,category,price,availability,description,details,images,url
32LT340C,,Коммерческие телевизоры,0,Наличие:В наличии,"Описание Экран приветствия USB-клонирование WOL (пробуждение по локальной сети) SNMP (простой протокол сетевого управления) Автоматическое воспроизведение через USB Планировщик времени Клонирование настроек через USB-порт Эта функция позволяет использовать стандартный USB-накопитель для простого и быстрого клонирования настроек с одного базового телевизора на все остальные. Полностью автоматизированный процесс сокращает трудозатраты на установку. SuperSign Control Базовая управляющая программа поддерживает управление до 100 дисплеев через одну учетную запись на одном сервере. Удаленно настраиваются такие важные параметры, как мощность, громкость, планировщик, также поддерживается обновление прошивки. Выход на внешние динамики Подключив дополнительный динамик, посетители будут наслаждаться отличным звуком в любом уголке занимаемого вашей компанией пространства. Они могут слушать телевизор и управлять его громкостью так, как будто он находится рядом. Отельный режим Вы можете контролировать все параметры телевизоров, заданные по умолчанию, начиная с набора каналов и заканчивая функциями энергосбережения, предотвратить неправильное использование телевизоров или чрезмерное повышение уровня громкости, а также восстановить заводские настройки любого телевизора. Управление контентом через USB Управление содержимым с помощью USB-соединения (без подключения к серверу). * Поддерживаемые форматы: Видео (MPEG 1/2/4, H.264), Аудио (MP3, AC3, MPEG, AAC, HEAAC, LPCM), Изображения (JPEG, PNG, BMP) Совместимость с системами управления AV Телевизор LG сертифицирован Crestron ConnectedⓇ, что востребовано в системах для конференц-залов и является ответом на растущие потребности рынка корпоративных переговорных комнат.","Производитель: LG | Наименование: <h3>32LT340C</h3> | Партномер: <h3>32LT340C</h3> | Тип экрана: IPS | Размер экрана: 32 "" | Разрешение: 1.366 x 768 (FHD) | Яркость: 240 кд/м² | Аналоговые: PAL / SECAM | Цифровые: DVB-T2 / C / S2 | Соотношение сторон: 6 режимов (16: 9, оригинал, 4: 3, вертикальное масштабирование, всенаправленное масштабирование, простое сканирование) | Triple XD Engine: да | Real Cinema 24p (3 3): да | Аудиовыход / Динамик: 5 + 5 Вт / 2-канальная система | Режимы звука: 6 режимов (Стандарт, Кино, Четкий голос III, Спорт, Музыка, Игра) | Clear Voice: да (Clear Voice III) | USB-клонирование: да | Управление: WOL, SNMP, самодиагностика, TVLink Tuner, ИК выход, Multi IR Code, HTNG / HDMI-CEC | Замок Kensington: да | Установки: Отельный режим, режим блокировки, экран приветствия, изображение, карта канала, RJP совместимость, сертификат Crestron®, планировщик времени | Боковая сторона: Выход для наушников, вход HDMI, USB 2.0, слот CI | Задняя сторона: RF вход (2), аудиовход, компонентный аудиовход (RCA5), HDMI/HDCP, RGB вход, RS-232, RS-232, RJ45 (SNMP), внешний динамик | Источник питания: 100 ~ 240 В, 50/60 Гц | Потребляемая мощность: 33,4 Вт | Режим ожидания: 0,3 Вт | Корпус (Ш x В x Г): 739 x 441 x 74,6 (84)  мм (без подставки) | Масса (): без подставки: 4,85 кг<br>с подставкой: 4,9 кг | Размер упаковки (Ш x В x Г): 812 x 510 x 142 мм | Стандартный монтажный разъем VESA: 200 x 200 | Рабочая температура: от 0° C до 40° C | Влажность при эксплуатации: от 10% до 80%",https://risbar.kz/wp-content/uploads/product/32lt340c-1.jpg; https://risbar.kz/wp-content/uploads/product/32lt340c-2.jpg; https://risbar.kz/wp-content/uploads/product/32lt340c-3.jpg; https://risbar.kz/wp-content/uploads/product/32lt340c-4.jpg; https://risbar.kz/wp-content/uploads/product/32lt340c-5.jpg; https://risbar.kz/wp-content/uploads/product/32lt340c-6.jpg; https://risbar.kz/wp-content/uploads/product/32lt340c-7.jpg; https://risbar.kz/wp-content/uploads/product/32lt340c-8.jpg; https://risbar.kz/wp-content/uploads/product/32lt340c-9.jpg; https://risbar.kz/wp-content/uploads/product/32lt340c-2-550x365.jpg; https://risbar.kz/wp-content/uploads/product/32lt340c-3-550x365.jpg; https://risbar.kz/wp-content/uploads/product/32lt340c-4-550x365.jpg; https://risbar.kz/wp-content/uploads/product/32lt340c-5-550x365.jpg; https://risbar.kz/wp-content/uploads/product/32lt340c-6-550x365.jpg; https://risbar.kz/wp-content/uploads/product/32lt340c-7-550x365.jpg; https://risbar.kz/wp-content/uploads/product/32lt340c-8-550x365.jpg; https://risbar.kz/wp-content/uploads/product/32lt340c-9-550x365.jpg,https://risbar.kz/product/32lt340c/
32LT661HBZA,,Коммерческие телевизоры,0,Наличие:В наличии,"Описание Решение для управления гостиничными телевизорами Pro:Centric Распознавание голосовых команд Меню быстрых настроек Стандартный гостиничный телевизор с Pro:Centric Smart Стандартный гостиничный телевизор с Pro:Centric Smart Улучшите впечатления от пребывания в номере и имидж гостиницы с помощью интерактивного интеллектуального решения Pro:Centric SMART. Серия LT661H включает в себя инструменты SDK, предварительно загруженные приложения и программное обеспечение Pro:Centric SMART/Direct/V для управления контентом гостиницы, которое может настраиваться пользователями в зависимости от индивидуальных потребностей. ПЛАТФОРМА ПРИЛОЖЕНИЙ PRO:CENTRIC SMART Решение для управления гостиничными телевизорами Pro:Centric Pro:Centric SMART оптимизировано для индивидуальной настройки гостиничных услуг в соответствии с требованиями гостиничных брендов и гостей через инфраструктуру IP и РЧ. Благодаря высокому качеству изображения, изысканному дизайну и расширенным функциям подключения это решение расширяет возможности развлечений в номере и повышает удобство за счет использования новейших технологий ПЛАТФОРМА ПРИЛОЖЕНИЙ PRO:CENTRIC SMART Серверное приложение Pro:Centric Теперь уникальность вашей гостиницы можно представить с помощью наших настраиваемых шаблонов и страниц. Pro:Centric предлагает вам решение, разработанное с учетом особых потребностей вашего бизнеса. ПЛАТФОРМА ПРИЛОЖЕНИЙ PRO:CENTRIC SMART Решение Pro:Centric Direct Pro:Centric Direct — это система управления контентом гостиницы, которая поддерживает простые инструменты редактирования и предоставляет различные решения, такие как 1-Click Service и удаленное управление на основе IP-сети. С помощью этого решения пользователи могут легко редактировать пользовательский интерфейс, предоставлять индивидуальные услуги и эффективно управлять всеми телевизорами. ПРОСТОТА И УДОБСТВО ДЛЯ ПОЛЬЗОВАТЕЛЕЙ Smart TV от LG webOS 4.5 Это телевизор LG Smart TV с webOS 4.5. Изучите новейшие функции LG Smart TV и откройте для себя телевизоры, которые предлагают инновационные технологии, удивительную четкость и реалистичные цвета. ПРОСТОТА И УДОБСТВО ДЛЯ ПОЛЬЗОВАТЕЛЕЙ Распознавание голосовых команд От слаженного взаимодействия до единообразного пользовательского опыта, LG делает еще один шаг вперед к лидерству на рынке коммерческих телевизоров, включая распознавание голосовых команд, что позволяет пользователям легко управлять телевизорами LG. * ТВ родной контроль * Серверное управление * Требуется Magic Motion Remote (продается отдельно) ПРОСТОТА И УДОБСТВО ДЛЯ ПОЛЬЗОВАТЕЛЕЙ Soft AP Программная точка доступа (SoftAP) — это «виртуальная» функция Wi-Fi, которая использует программное обеспечение для создания беспроводной точки доступа. Текущая версия поддерживает режим моста, который позволяет администраторам сети контролировать подключенные устройства. * SoftAP должен быть установлен в меню установки после включения телевизора. * Smart Mirroring не может работать одновременно. ПРОСТОТА И УДОБСТВО ДЛЯ ПОЛЬЗОВАТЕЛЕЙ Мгновенное включение Высокоскоростная система загрузки позволяет пользователям наслаждаться контентом сразу после включения телевизора. ПРОСТОТА И УДОБСТВО ДЛЯ ПОЛЬЗОВАТЕЛЕЙ SmartShare Функция SmartShare позволяет пользователям быстрее делиться контентом. С ее помощью также осуществляется поиск нужного контента для обеспечения простоты доступа к нему, тем самым упрощается синхронизация данных разных устройств. ПРОСТОТА И УДОБСТВО ДЛЯ ПОЛЬЗОВАТЕЛЕЙ ScreenShare Подключите к телевизору смартфон или ноутбук с помощью Wi-Fi Direct. Экран устройства отобразится на телевизоре, и пользователи смогут синхронизировать контент и файлы. ПРОСТОТА И УДОБСТВО ДЛЯ ПОЛЬЗОВАТЕЛЕЙ Технология Bluetooth Sound Sync Технология Bluetooth Sound Sync позволяет пользователям слушать музыку с мобильного устройства на динамиках телевизора с помощью Bluetooth-соединения. * Поддержка устройств для Bluetooth Sound Sync: мобильное устройство на базе Android (выше v4.4 Kitkat) / iOS ПРОСТАЯ НАСТРОЙКА И ОБСЛУЖИВАНИЕ Меню быстрых настроек Насладитесь простым решением главного меню LG. Теперь LG предлагает новое меню быстрых настроек (версия 3.0), которое делает его использование еще проще и удобнее. Решение было значительно модернизировано. Кроме того, в него был добавлен новый инструмент для создания рекламного видео гостиницы. ПРОСТАЯ НАСТРОЙКА И ОБСЛУЖИВАНИЕ Гостиничный режим Гостиничный режим позволяет управлять настройками телевизоров во всех номерах с панели управления, включая выбор каналов и функции энергосбережения. Вы можете предотвратить ненадлежащее использование, ограничить уровень громкости или восстановить настройки по умолчанию для любого телевизора. Все под вашим контролем. ПРОСТАЯ НАСТРОЙКА И ОБСЛУЖИВАНИЕ Приветственное видео / экран приветствия Телевизоры Commercial Lite позволяют разнообразить приветственные сообщения в гостиничных номерах с помощью повторяющихся изображений и видео различных форматов, чтобы клиенты чувствовали себя еще комфортнее. ПРОСТАЯ НАСТРОЙКА И ОБСЛУЖИВАНИЕ EzManager EzManager предоставляет удобную функцию установки для автоматической настройки параметров телевизора Pro: Centric без приложения дополнительных усилий по настройке. Автоматическая установка займет 1-3 минуты, а на ручную настройку уйдет 3-5 минут. ПРОСТАЯ НАСТРОЙКА И ОБСЛУЖИВАНИЕ Клонирование через USB Клонирование данных через USB делает управление несколькими дисплеями более эффективным, что обеспечивает оптимальную работу. Вместо того, чтобы настраивать каждый дисплей отдельно, данные одного дисплея можно копировать на USB-накопитель, а затем загрузить на другие дисплеи с помощью USB. ПРОСТАЯ НАСТРОЙКА И ОБСЛУЖИВАНИЕ Pro:Idiom Система DRM (средства защиты авторских прав) позволяет предотвратить несанкционированное копирование контента.","Производитель: LG | Наименование: <h3>32LT661HBZA</h3> | Партномер: <h3>32LT661HBZA</h3> | Размер экрана: 32 дюйма | Тип подсветки: Прямая подсветка | Разрешение: 1366 x 768 (HD) | Яркость: 240 кд/м² | Цифровая: DVB-T2/C/S2 | Аудиовыход: 5 Вт + 5 Вт | Настройка звука одним касанием: Да | Система динамиков: 2.0 | Технология LG Sound Sync: Требуется Bluetooth | Тип решения: Pro:Centric (Smart, V, Direct), Quick Menu 3.0 | HCAP (GEM/FLASH/HTML)※ Service Carousel (TLL/XML): GEM / HTML5 | Готовность к Multicast / Unicast: Да | Приложение ProCentric (версия): PCA3.8 | DRM: Pro:Idiom (тип ПО), Pro:Idiom Media | Трансляция данных (IP и РЧ): Да | IP Return path: Да | webRTC (Передача данных в реальном времени): Да | Сервер ProCentric: PCS400R | Гостиничное хозяйство: Гостиничный режим (меню установщика), режим блокировки (ограниченный), приветственное видео / экран приветствия (заставка), изображение для вставки, единый список каналов, диспетчер IP-каналов, выход на внешние динамики (Int / Ext Variable / Fixed), мгновенное включение, совместимость с интерфейсом RJP, воспроизведение движущихся изображений (SD / HD / Plus HD), таймер автоматического выключения / перехода в режим сна, Smart Energy Saving, Motion Eye Care | Боковая сторона: Вход HDMI (2.0), USB 2.0 (2), гнездо CI | Задняя сторона: Вход HDMI (HDCP, 2.0), USB 2.0 (1, кроме 32 дюйма), выход для наушников (1, только 32 дюйма), вход РЧ (2), AV-вход (штекер телефонного типа), компонентный вход (Y, Pb, Pr, штекер телефонного типа), цифровой аудиовыход (оптический), RS-232C (управление и обслуживание), RJ45 (назначение: 1 (Ethernet)), выходы на внешние динамики (под штекер диаметром 3,5 мм): 2 (выход для динамиков 1, 4 Вт (стерео, П: 2,0 Вт, Л: 2,0 Вт, 8Ω) — регулировка громкости — 1) | Vesa: 200 x 200 | Ш x В x Г, вес (без подставки): 739 x 441 x 84, 4,85 | Ш x В x Г, вес (с подставкой): 739 x 495 x 241, 6,05 | Ш x В x Г, вес (в транспортировочной упаковке): 905 x 530 x 162, 7,35 | Источник питания (напряжение, частота): 100–240 В переменного тока, 50/60 Гц | Режим ожидания: 0,3 Вт | Стандарт: 46,3 Вт",https://risbar.kz/wp-content/uploads/product/32lt661hbza-1.jpg; https://risbar.kz/wp-content/uploads/product/32lt661hbza-2.jpg; https://risbar.kz/wp-content/uploads/product/32lt661hbza-3.jpg; https://risbar.kz/wp-content/uploads/product/32lt661hbza-4.jpg; https://risbar.kz/wp-content/uploads/product/32lt661hbza-5.jpg; https://risbar.kz/wp-content/uploads/product/32lt661hbza-6.jpg; https://risbar.kz/wp-content/uploads/product/32lt661hbza-7.jpg; https://risbar.kz/wp-content/uploads/product/32lt661hbza-8.jpg; https://risbar.kz/wp-content/uploads/product/32lt661hbza-2-550x365.jpg; https://risbar.kz/wp-content/uploads/product/32lt661hbza-3-550x365.jpg; https://risbar.kz/wp-content/uploads/product/32lt661hbza-4-550x365.jpg; https://risbar.kz/wp-content/uploads/product/32lt661hbza-5-550x365.jpg; https://risbar.kz/wp-content/uploads/product/32lt661hbza-6-550x365.jpg; https://risbar.kz/wp-content/uploads/product/32lt661hbza-7-550x365.jpg; https://risbar.kz/wp-content/uploads/product/32lt661hbza-8-550x365.jpg,https://risbar.kz/product/32lt661hbza/
