title,article,category,price,availability,description,details,images,url
DCS-2057D,,Модули врезного монтажа 10000N,0,Наличие:В наличии,"Описание Gonsin DCS-2057D — выносной ручной микрофон серии DCS-Q2057 предназначен для установки на подлокотнике кресла и организации места участника совещания на базе конференц-системы 10000N. Микрофон подключается к центральному оборудованию системы 10000N через интерфейсный коммутационный модуль DCS-CON2057 или врезные панели с помощью разъема RJ45. Микрофон оснащен витым кабелем, длину которого можно заказать под конкретный проект. Ручной микрофон выполнен в цельнометаллическом корпусе и предназначен для совместного использования с врезными функциональными панелями. Прозрачная силиконовая кнопка включения микрофона с индикатором состояния точно реагирует и имеет длительный срок службы. Микрофон обладает высокой устойчивостью к помехам от мобильных телефонов. Устройство использует технологию цифровой обработки и передачи звука в соответствии с международным стандартом IEC60914. Поддерживает частоту дискретизации аудио 48 кГц , акустическая частотная характеристика может достигать 20 Гц — 20 кГц. Чувствительность каждого модуля можно отрегулировать независимо или одинаково. Основное оборудование, такое как конференц-пульты, концентратор питания и сервер конференц-системы поддерживают гибкую кабельную топологию , включая шлейфовое подключение, соединение звездой и смешанное подключение. Это снижает рабочую нагрузку на проект и упрощает крупномасштабную установку. Поломка одного устройства не повлияет на другие устройства, а неисправность кабеля одного модуля не повлияет на всю систему, обеспечивая стабильность системы. Функция автоматического восстановления с поддержкой горячего подключения. Функция регистрации присутствия : модуль использует регистрацию по нажатию кнопки. Функция автоматического отслеживания выступающих с помощью HD видеокамер , с поддержкой настройки препозиций и общего панорамного вида. Микрофон может быть установлен и использован совместно с врезной панелью селектора каналов синхронного перевода и/или врезной панелью голосования для расширения функциональных возможностей места участника конференции. Любому месту делегата можно назначить права председателя или заместителя председателя. Максимальное количество мест , которые можно включить одновременно – 5. Режимы управления микрофонами Несколько режимов управления микрофонами : автоматический, с вытеснением, под управлением оператора и голосовой активации. Функция голосовой активации (VOX) : в режиме VOX устройство включается при разговоре пользователя, чувствительность может быть настроена сервером; время паузы микрофона регулируется. Автоматический режим : можно активировать только то количество микрофонов, которое ограничено системой. Когда количество открытых микрофонов превышает установленный системный лимит, при нажатии кнопки включения микрофон не может быть включен, и необходимо выключить ранее включенные микрофоны, а затем микрофон можно включить, нажав кнопку включения микрофона заново. Режим вытеснения (FIFO) : когда количество открытых микрофонов превышает установленный системный лимит, нажатие кнопки включения микрофона включит микрофон и автоматически выключит микрофон, который был активен раньше всех. Режим под управлением оператора : когда количество открытых микрофонов превышает лимит, нажатие кнопки включения микрофона вводит пульт в режим ожидания. После выключения активных микрофонов микрофоны из очереди включатся автоматически.","Производитель: Gonsin | Наименование: <h3>DCS-2057D</h3> | Партномер: <h3>300922081003B</h3> | Монтаж: Установка на подлокотник кресла | Способ подключения: Коннектор RJ45 | Частотная характеристика: 20 Гц — 20 кГц | Чувствительность: -46 дБВ/Па | Чувствительность функции голосовой активации (VOX): 76 дБ / 80 дБ / 82дБ | Входной импеданс: 2 кОм | Эквивалентный уровень шума: 20 дБА (УЗД) | Максимальный уровень звукового давления: 125 дБ (КНИ < 3%) | Характеристика направленности микрофона: Кардиоидная | Направленность: 0°/180° > 20 дБ (1 кГц) | Напряжение питания: 24 В пост. тока | Максимальная потребляемая мощность: 6,4 Вт | Размеры микрофона: 191 × 27,8 × 27,8 мм | Вес: 0,22 кг | Цвет: Металлический серый | Рабочая температура: От 0 ºC до +45 ºC | Температура хранения: От -20 ºC до +50 ºC",https://risbar.kz/wp-content/uploads/product/dcs-2057d-1.png; https://risbar.kz/wp-content/uploads/product/dcs-2057d-2.png,https://risbar.kz/product/dcs-2057d/
DCS-CON2057,,Модули врезного монтажа 10000N,0,Наличие:В наличии,"Описание Коммутационный модуль Gonsin DCS-CON2057 предназначен для подключения врезных дискуссионных модулей серии DCS-Q2057 в состав цифровой конференц-системы 10000N. Модуль имеет компактный цельнометаллический корпус, прочный и долговечный, с установочными отверстиями, предоставляющими возможность скрытого монтажа. Устройство использует технологию цифровой обработки и передачи звука в соответствии с международным стандартом IEC60914. Модуль реализует связь между врезным дискуссионным модулем и сервером системы , один разъем может подключать один дискуссионный модуль. Модуль обеспечивает подачу питания на врезной дискуссионный модуль. Если имеется только базовый дискуссионный модуль, требуется использовать коммутационный модуль DCS-CON2057 для его подключения в систему. Если врезной дискуссионный модуль расширяется другими врезными панелями, то коммутационный модуль может не использоваться. Основное оборудование, такое как конференц-пульты, концентратор питания и сервер конференц-системы поддерживают гибкую кабельную топологию , включая шлейфовое подключение, соединение звездой и смешанное подключение. Это снижает рабочую нагрузку на проект и упрощает крупномасштабную установку. Поломка одного устройства не повлияет на другие устройства, а неисправность кабеля одного модуля не повлияет на всю систему, обеспечивая стабильность системы. Функция автоматического восстановления с поддержкой горячего подключения.","Производитель: Gonsin | Наименование: <h3>DCS-CON2057</h3> | Партномер: <h3>300214000010B</h3> | Монтаж: Настольный или скрытый | Способ подключения: Разъемы 3 х RJ45 | Размеры модуля (Д×Ш×В): 158 × 40 × 111,5 мм | Вес: 0,4 кг | Цвет: Чёрный | Рабочая температура: От 0 ºC до +45 ºC | Температура хранения: От -20 ºC до +50 ºC",https://risbar.kz/wp-content/uploads/product/dcs-con2057-1.png,https://risbar.kz/product/dcs-con2057/
DCS-Q2057C,,Модули врезного монтажа 10000N,0,Наличие:В наличии,"Описание Gonsin DCS-Q2057C — врезной дискуссионный модуль председателя серии Gonsin DCS-Q2057 предназначен для участия в совещаниях, организованных на базе конференц-системы 10000N. Модуль выполнен в виде цельнометаллической панели привлекательного дизайна, подходящей для установки заподлицо, и идет в комплекте со съёмным кардиоидным микрофоном на гусиной шее 410 мм со светодиодным индикатором и ветрозащитой. Модуль оснащен кнопкой включения микрофона с индикатором активности и кнопкой приоритета. Модуль подключается к центральному оборудованию системы 10000N через интерфейсный коммутационный модуль DCS-CON2057 или врезные панели с помощью разъема RJ45. Микрофон на гусиной шее : к дискуссионному модулю подключается съёмный микрофон на гибкой подставке типа «гусиная шея», который может быть отсоединен, когда модуль не используется, что делает его удобным для обслуживания оборудования. Электретный микрофон с кардиоидной характеристикой направленности имеет светодиодное индикаторное кольцо и подставку с двумя гибкими участками. В стандартную комплектацию включен микрофон длиной 410 мм, дополнительно можно заказать микрофон с гусиной шеей длиной 310 мм или 510 мм. Микрофон обладает высокой устойчивостью к помехам от мобильных телефонов. Устройство использует технологию цифровой обработки и передачи звука в соответствии с международным стандартом IEC60914. Поддерживает частоту дискретизации аудио 48 кГц , акустическая частотная характеристика может достигать 20 Гц — 20 кГц. Чувствительность каждого модуля можно отрегулировать независимо или одинаково. Физическая кнопка включения микрофона использует сенсорный дизайн, имеет лаконичный внешний вид, удобное управление, точный отклик и долгий срок службы. Основное оборудование, такое как конференц-пульты, концентратор питания и сервер конференц-системы поддерживают гибкую кабельную топологию , включая шлейфовое подключение, соединение звездой и смешанное подключение. Это снижает рабочую нагрузку на проект и упрощает крупномасштабную установку. Поломка одного устройства не повлияет на другие устройства, а неисправность кабеля одного модуля не повлияет на всю систему, обеспечивая стабильность системы. Функция автоматического восстановления с поддержкой горячего подключения. Функция регистрации присутствия : модуль использует регистрацию по нажатию кнопки Система имеет возможность проводить дополнительную регистрацию или отмену регистрации. Функция автоматического отслеживания выступающих с помощью HD видеокамер , с поддержкой настройки препозиций и общего панорамного вида. Несколько режимов управления микрофонами : автоматический, с вытеснением, под управлением оператора и голосовой активации. Максимальное количество мест, которые можно включить одновременно – 5. Дискуссионный модуль может быть установлен и использован совместно с врезной панелью селектора каналов синхронного перевода и/или врезной панелью голосования для расширения функциональных возможностей места участника конференции. Любому месту делегата можно назначить права председателя или заместителя председателя. Помимо всех функций модуля делегата, модуль председателя имеет следующие функции. 1. Микрофон модуля председателя можно включить в любое время без предварительной настройки ограничения на время выступления. 2. Модуль председателя оснащен кнопкой приоритета председателя для отключения всех активных микрофонов мест делегатов. 3. Количество мест председателя и заместителя председателя в системе не ограничено. Режимы управления микрофонами Несколько режимов управления микрофонами : автоматический, с вытеснением, под управлением оператора и голосовой активации. Функция голосовой активации (VOX) : в режиме VOX устройство включается при разговоре пользователя, чувствительность может быть настроена сервером; время паузы микрофона регулируется. Автоматический режим : можно активировать только то количество микрофонов, которое ограничено системой. Когда количество открытых микрофонов превышает установленный системный лимит, при нажатии кнопки включения микрофон не может быть включен, и необходимо выключить ранее включенные микрофоны, а затем микрофон можно включить, нажав кнопку включения микрофона заново. Режим вытеснения (FIFO) : когда количество открытых микрофонов превышает установленный системный лимит, нажатие кнопки включения микрофона включит микрофон и автоматически выключит микрофон, который был активен раньше всех. Режим под управлением оператора : когда количество открытых микрофонов превышает лимит, нажатие кнопки включения микрофона вводит пульт в режим ожидания. После выключения активных микрофонов микрофоны из очереди включатся автоматически.","Производитель: Gonsin | Наименование: <h3>DCS-Q2057C</h3> | Партномер: <h3>300212050007B</h3> | Монтаж: Врезная установка в поверхность стола или  подлокотник кресла | Способ подключения: Разъем RJ45 | Частотная характеристика: 20 Гц — 20 кГц | Чувствительность: -46 дБВ/Па | Чувствительность функции голосовой активации (VOX): 76 дБ / 80 дБ / 82дБ | Входной импеданс: 2 кОм | Эквивалентный уровень шума: 20 дБА (УЗД) | Максимальный уровень звукового давления: 125 дБ (КНИ < 3%) | Характеристика направленности микрофона: Кардиоидная | Направленность: 0°/180° > 20 дБ (1 кГц) | Напряжение питания: 24 В пост. тока | Максимальная потребляемая мощность: 6,4 Вт | Размеры микрофона на гусиной шее: 410 мм (стандартный) | Размеры панели (Д×Ш×В): 83 × 40 × 3,5 мм | Размеры модуля (Д×Ш×В): 83 × 40 × 44 мм | Вес: 0,16 кг | Цвет: Чёрный | Рабочая температура: От 0 ºC до +45 ºC | Температура хранения: От -20 ºC до +50 ºC",https://risbar.kz/wp-content/uploads/product/dcs-q2057c-1.png; https://risbar.kz/wp-content/uploads/product/dcs-q2057c-2.png; https://risbar.kz/wp-content/uploads/product/dcs-q2057c-3.png,https://risbar.kz/product/dcs-q2057c/
