title,article,category,price,availability,description,details,images,url
105-607,,Объективы,0,Наличие:В наличии,"Описание Объектив Titan/Mercury WUXGA 0,67:1. SX+ Объектив проекционное соотношение 0,73:1",Производитель: Digital Projection | Наименование: <h3>105-607</h3> | Партномер: <h3>105-607</h3>,,https://risbar.kz/product/105-607/
105-608,,Объективы,0,Наличие:В наличии,"Описание Объектив Titan/Mercury WUXGA 1,12:1. SX+ Объектив проекционное соотношение 1,21:1",Производитель: Digital Projection | Наименование: <h3>105-608</h3> | Партномер: <h3>105-608</h3>,,https://risbar.kz/product/105-608/
105-610,,Объективы,0,Наличие:В наличии,"Описание Объектив Lens Titan/Mercury WUXGA 1,39-1,87:1. SX+ Объектив проекционное соотношение 1,50-2,02:1",Производитель: Digital Projection,https://risbar.kz/wp-content/uploads/product/105-610-1.jpg,https://risbar.kz/product/105-610/
112-499,,Объективы,0,Наличие:В наличии,"Описание Объектив E-Vision 0,76:1 WUXGA (КРОМЕ 6500 & 9000 Laser). Digital Projection 112-499 Моторизованный короткофокусный объектив E-Vision для проекторов 6900, 8500, Laser 10K, Laser 1300, Laser 4K, Laser 1100.",Производитель: Digital Projection | Наименование: <h3>112-499</h3> | Партномер: <h3>112-499</h3>,https://risbar.kz/wp-content/uploads/product/112-499-1.jpg,https://risbar.kz/product/112-499/
112-500,,Объективы,0,Наличие:В наличии,"Описание Объектив проектора с 1,43-кратным зумом имеет возможности увеличения и фокусировки для дистанционной настройки. 1,28-1,85:1 на XGA, 1,31-1,88:1 на WXGA 1.24-1.78:1 на 4K-UHD",Производитель: Digital Projection | Наименование: <h3>112-500</h3> | Партномер: <h3>112-500</h3>,https://risbar.kz/wp-content/uploads/product/112-500-1.jpg,https://risbar.kz/product/112-500/
112-501,,Объективы,0,Наличие:В наличии,"Описание 1,77-2,34:1 на XGA, 1,80-2,38:1 на WXGA 1.71-2.25:1 на 4K-UHD. Объектив проектора с 1,31-кратным зумом имеет возможности увеличения и фокусировки для дистанционной настройки.",Производитель: Digital Projection,https://risbar.kz/wp-content/uploads/product/112-501-1.jpg,https://risbar.kz/product/112-501/
112-503,,Объективы,0,Наличие:В наличии,"Описание Объектив E-Vision 3,58-5,38:1 для WUXGA (КРОМЕ 6500 & 9000 Laser) 3,54-5,36:1 для 4K-UHD. 3,67-5,58:1 на XGA, 3,74-5,67:1 на WXGA 3.54-5.36:1 на 4K-UHD",Производитель: Digital Projection | Наименование: <h3>112-503</h3> | Партномер: <h3>112-503</h3>,https://risbar.kz/wp-content/uploads/product/112-503-1.jpg,https://risbar.kz/product/112-503/
115-339,,Объективы,0,Наличие:В наличии,"Описание Объектив Digital Projection 115-339 Zoom с 1,27-кратным зумом имеет возможности увеличения и фокусировки для дистанционной настройки.",Производитель: Digital Projection,https://risbar.kz/wp-content/uploads/product/115-339-1.jpg,https://risbar.kz/product/115-339/
115-627,,Объективы,0,Наличие:В наличии,"Описание Объектив для проектора Lens Insight 1,13-1,72:1. Объектив проектора с 1,52-кратным зумом имеет возможности увеличения и фокусировки для дистанционной настройки.",Производитель: Digital Projection,https://risbar.kz/wp-content/uploads/product/115-627-1.jpg,https://risbar.kz/product/115-627/
115-630,,Объективы,0,Наличие:В наличии,"Описание Объектив для проектора Lens Insight 1,65-2,60:1. Объектив проектора с 1,58-кратным зумом имеет возможности увеличения и фокусировки для дистанционной настройки.",Производитель: Digital Projection,https://risbar.kz/wp-content/uploads/product/115-630-1.jpg,https://risbar.kz/product/115-630/
115-632,,Объективы,0,Наличие:В наличии,"Описание Объектив для проектора Insight 2,53-4,98:1. Объектив проектора с 1,97-кратным зумом имеет возможности увеличения и фокусировки для дистанционной настройки.",Производитель: Digital Projection,https://risbar.kz/wp-content/uploads/product/115-632-1.jpg,https://risbar.kz/product/115-632/
116-208,,Объективы,0,Наличие:В наличии,"Описание Объектив E-Vision 3,00-5,00:1 на 1080p/WUXGA (4500/Laser 6500 только для этих моделей).",Производитель: Digital Projection,https://risbar.kz/wp-content/uploads/product/116-208-1.jpg,https://risbar.kz/product/116-208/
117-310,,Объективы,0,Наличие:В наличии,"Описание Объектив Insight 0,93:1 для всех моделей Insight. Объектив проектора можно дистанционно сфокусировать с помощью функции мощной фокусировки.",Производитель: Digital Projection,https://risbar.kz/wp-content/uploads/product/117-310-1.jpg,https://risbar.kz/product/117-310/
117-341,,Объективы,0,Наличие:В наличии,"Описание Объектив E-Vision 0,38:1 on WUXGA (для всех, кроме 6500 и 9000 Laser). 0.39:1 на XGA/WXGA, 0.38:1 на WUXGA/1080p, 0.38:1 на 4K-UHD",Производитель: Digital Projection | Наименование: <h3>117-341</h3> | Партномер: <h3>117-341</h3>,https://risbar.kz/wp-content/uploads/product/117-341-1.jpg,https://risbar.kz/product/117-341/
119-430,,Объективы,0,Наличие:В наличии,"Описание Объектив E-Vision 1,25-1,60:1 на WUXGA (только для E-Vision Laser 6500)",Производитель: Digital Projection,https://risbar.kz/wp-content/uploads/product/119-430-1.png,https://risbar.kz/product/119-430/
120-624,,Объективы,0,Наличие:В наличии,"Описание Объектив M-Vision Laser, моторизированный 0,9-1,2:1. Объектив проектора с 1,33-кратным зумом имеет возможности увеличения и фокусировки для дистанционной настройки. 0.9 — 1.2 : 1 zoom Оптимизированный диапазон фокусировки 0,92 м — 13,46 м Сдвиг объектива по вертикали: 0.45 (U) 0.45 (D) frame, / по горизонтали : 0.15 (L) 0.15 (R) frame",Производитель: Digital Projection | Наименование: <h3>120-624</h3> | Партномер: <h3>120-624</h3>,https://risbar.kz/wp-content/uploads/product/120-624-1.jpg,https://risbar.kz/product/120-624/
120-625,,Объективы,0,Наличие:В наличии,"Описание Объектив M-Vision Laser, моторизованный 1,20-1.56:1 с энкодером, Объектив проектора с 1,30-кратным зумом имеет возможности увеличения и фокусировки для дистанционной настройки. 1.20 — 1.56 : 1 zoom Оптимизированный диапазон фокусировки 1 м — 17,5 м Сдвиг объектива по вертикалиt: 0.5 (U) 0.5 (D) frame / по горизонтали: 0.15 (L) 0.15 (R) frame",Производитель: Digital Projection | Наименование: <h3>120-625</h3> | Партномер: <h3>120-625</h3>,,https://risbar.kz/product/120-625/
120-626,,Объективы,0,Наличие:В наличии,"Описание Объектив M-Vision Laser, моторизованный 1,50-2,00:1 с энкодером 1.50 — 2.00 : 1 zoom Оптимизированный диапазон фокусировки 2 м — 21,8 м Сдвиг объектива по вертикали: 0.5 (U) 0.3 (D) frame, / по горизонтали: 0.15 (L) 0.15 (R) frame",Производитель: Digital Projection | Наименование: <h3>120-626</h3> | Партномер: <h3>120-626</h3>,,https://risbar.kz/product/120-626/
120-627,,Объективы,0,Наличие:В наличии,"Описание Объектив M-Vision Laser, моторизованный 2,00-4,00:1 с энкодером. 2.00 — 4.00 : 1 zoom Оптимизированный диапазон фокусировки 2,5 м — 41,8 м Сдвиг объектива по вертикали: 0.5 (U) 0.3 (D) frame, / по горизонтали: 0.15 (L) 0.15 (R) frame",Производитель: Digital Projection | Наименование: <h3>120-627</h3> | Партномер: <h3>120-627</h3>,,https://risbar.kz/product/120-627/
120-628,,Объективы,0,Наличие:В наличии,"Описание Объектив M-Vision Laser, моторизованный 4,00-7,00:1 с энкодером. 4.00 — 7.00 : 1 zoom Оптимизированный диапазон фокусировки 4 м — 42 м Сдвиг объектива по вертикали: 0.5 (U) 0.3 (D) frame, / по горизонтали: 0.15 (L) 0.15 (R) frame",Производитель: Digital Projection | Наименование: <h3>120-628</h3> | Партномер: <h3>120-628</h3>,,https://risbar.kz/product/120-628/
SD63,,Объективы,0,Наличие:В наличии,"Описание Zoom x 1,25 Проекционное соотношение 1,54 – 1,93 Размер экрана по диагонали 37 – 211 дюймов Проекционное расстояние для экрана 100”: 3,3 – 4,3 м Сдвиг объектива Стандартный объектив Hitachi SD-63 предназначен для использования с лазерным проектором LP-WU6600. Объектив поддерживает вертикальный и горизонтальный сдвиг для перемещения изображения вверх / вниз и влево / вправо, что повышает гибкость при установке проектора. Объектив предназначен для средних и больших площадок.",Производитель: Hitachi,https://risbar.kz/wp-content/uploads/product/sd63-1.jpg,https://risbar.kz/product/sd63/
UL906,,Объективы,0,Наличие:В наличии,"Описание Супердлиннофокусный объектив объектив от Maxell предназначен для использования с проектором MP-WU9101B. Моторизованный Zoom x 1,6; Проекционное расстояние для 100″ экрана (полное заполнение) (от линзы до экрана) — 12,0 – 19,0 м; Проекционное соотношение — 5,5 – 8,8.","Производитель: Maxell | Наименование: <h3>UL906</h3> | Проекционное расстояние для 100: 12,0 – 19,0 м | Проекционное соотношение: 5,5 – 8,8",https://risbar.kz/wp-content/uploads/product/ul906-1.jpg,https://risbar.kz/product/ul906/
USL701,,Объективы,0,Наличие:В наличии,"Описание Ультракороткофокусный объектив Maxell USL-701 оснащен стеклянной линзой, которая уменьшает размытость, возникающую при больших перепадах температур. Он предназначен для использования с проекторами Maxell моделей MP-WU8701, MP-WU8801.","Производитель: Maxell | Наименование: <h3>USL701</h3> | Throw ratio: Wide 0,74<br>Tele 0,98 | Проекционное расстояние при 100&quot;: WUXGA 0.76” — Wide 1,6 м / Tele 2,1 м | F-число: Wide 1,7<br>Tele 2,0 | Zoom: x1,3 | Масса: 1,7 кг",https://risbar.kz/wp-content/uploads/product/usl701-1.jpg,https://risbar.kz/product/usl701/
